{
  "$comment": "Curated static example authored from the inventory. It is not generated by a runtime golden-flow execution.",
  "flowId": "launch-board-01",
  "flowArchetype": "workflow-planning",
  "steps": [
    {
      "stepId": "release-board",
      "order": 1,
      "userIntents": ["browse", "create", "edit", "monitor"],
      "jobMapStages": ["locate", "modify", "monitor"],
      "dataShapes": ["collection", "categorical"],
      "interactionModels": ["drag-drop", "filter-sort", "multi-action"],
      "density": "high",
      "requiredStates": ["default", "empty"],
      "accessibilityConstraints": { "keyboard": true, "focusVisible": true, "labels": true },
      "visualTone": ["enterprise", "utilitarian"],
      "transitions": {
        "cardMovement": "Dragging a card onto a column, or using its move control, changes which workflow status owns the card and updates every column count.",
        "boardControls": "Search and the column selector narrow the visible cards; an empty result offers Clear filters.",
        "workItemCreation": "New work item appends a local card to the Backlog column."
      }
    }
  ]
}
