{
  "$comment": "Curated static example authored from the inventory. It is not generated by a runtime golden-flow execution.",
  "flowId": "support-inbox-01",
  "flowArchetype": "communication-triage",
  "steps": [
    {
      "stepId": "triage-inbox",
      "order": 1,
      "userIntents": ["communicate", "review", "monitor", "filter"],
      "jobMapStages": ["locate", "execute", "conclude"],
      "dataShapes": ["conversation", "collection"],
      "interactionModels": ["filter-sort", "selection-single", "multi-action", "real-time"],
      "density": "high",
      "requiredStates": ["default", "empty"],
      "accessibilityConstraints": { "keyboard": true, "focusVisible": true, "labels": true },
      "visualTone": ["enterprise", "utilitarian"],
      "transitions": {
        "conversationFiltering": "Search and the status selector narrow the visible conversations; the view toggle switches the list between rows and a card grid. An empty result offers Clear filters.",
        "conversationSelection": "Selecting a conversation opens its message thread in the reading pane; with none selected the pane prompts the reader to choose one.",
        "reply": "Replying appends a message to the active thread, requires a non-empty body, reopens the conversation, and claims it for the operator when it was unassigned.",
        "lifecycle": "Assign toggles ownership between the operator and Unassigned; Snooze, Close, and Reopen move the conversation between its open, snoozed, and closed states from the list and the thread header.",
        "conversationCreation": "New conversation opens a Dialog requiring a non-empty sender, subject, and first message; submitting adds an open conversation to the top of the inbox and selects it.",
        "inboxPersistence": "Every reply, lifecycle change, and new conversation is saved to localStorage; reloading the page restores that saved inbox. Reset inbox discards it and restores the seed conversations."
      }
    }
  ]
}
