{
  "$comment": "Curated static example authored by the top-level AI from the current inventory. This file was not generated by a runtime golden-flow execution.",
  "flowId": "ops-pulse-01",
  "flowArchetype": "monitoring",
  "steps": [
    {
      "stepId": "operations-overview",
      "order": 1,
      "userIntents": ["monitor", "analyze", "browse", "review", "approve"],
      "jobMapStages": ["monitor", "confirm", "execute"],
      "dataShapes": ["metric", "time-series", "collection"],
      "interactionModels": ["read-only", "filter-sort", "selection-single", "modal-task", "single-action"],
      "density": "high",
      "requiredStates": ["default"],
      "accessibilityConstraints": {
        "keyboard": true,
        "focusVisible": true,
        "labels": true
      },
      "visualTone": ["enterprise", "utilitarian"],
      "transitions": {
        "primaryNavigation": "Client-side navigation switches the workspace between Overview, Incidents, and Services.",
        "periodSelection": "Selecting 7, 30, or 90 days updates fixture-backed availability, latency, error budget, request-volume bars, and labels.",
        "incidentInspection": "Selecting an incident opens its detail Dialog.",
        "incidentResolution": "Resolve is a client-only transition: it marks the selected incident resolved, closes the Dialog, lowers the active count, and restores the affected service when no active incident remains."
      }
    }
  ]
}
