{
  "$comment": "Curated static example authored from the inventory. It is not generated by a runtime golden-flow execution.",
  "flowId": "invoice-desk-01",
  "flowArchetype": "collection-management",
  "steps": [
    {
      "stepId": "invoice-collection",
      "order": 1,
      "userIntents": ["browse", "search", "filter", "review", "approve"],
      "jobMapStages": ["monitor", "find", "confirm", "execute"],
      "dataShapes": ["collection", "record", "metric"],
      "interactionModels": ["filter-sort", "selection-single", "view-switch", "modal-task", "single-action"],
      "density": "high",
      "requiredStates": ["default", "empty"],
      "accessibilityConstraints": { "keyboard": true, "focusVisible": true, "labels": true },
      "visualTone": ["enterprise", "utilitarian"],
      "transitions": {
        "primaryNavigation": "Client-side navigation switches the workspace between Invoices, Customers, and Collections.",
        "collectionControls": "Search, status selection, and table or grid controls update the visible invoice collection; empty results offer Clear filters.",
        "invoiceInspection": "Selecting a row, card, customer, or collection item opens its detail Dialog.",
        "paymentRecording": "Mark as paid is a client-only transition: it updates the selected invoice status and every fixture-derived summary, customer balance, and collection value."
      }
    }
  ]
}
